{"schema_version":1,"game":{"id":1,"slug":"neon-horizon","name":"Neon Horizon"},"detection":{"steam_app_id":"900001","epic_catalog_id":null,"executable":"NeonHorizon.exe","process_name":"NeonHorizon.exe","required_files":["NeonHorizon.exe"],"optional_files":["Content/Paks/game.pak"]},"patch":{"id":1,"version":"1.0.0","game_version":"1.0","minimum_loader_version":"0.1.0","mandatory":false,"channel":"stable"},"archive":{"download_token_url":"https://example.com/api/patches/1/download-token","sha256":"0000000000000000000000000000000000000000000000000000000000000000","size":1},"install_actions":[{"id":"550e8400-e29b-41d4-a716-446655440000","type":"REPLACE_FILE","source":"files/translation.dat","destination":"Localization/translation.dat","backup":true,"expected_sha256":null,"options":{}}],"integrity":{"verify_after_install":true,"conflict_policy":"abort"},"backup":{"automatic":true,"retain_until_uninstall":true}}

